{
  "version": 1,
  "name": "Lab-rinth",
  "description": "Find your way through three original maze levels.",
  "mobile": {
    "orientation": "landscape",
    "fullscreen": true,
    "controls": {
      "keyboard": false,
      "mouseButtons": false,
      "quickKeys": [
        "ESC",
        "ENTER"
      ],
      "joystick": false,
      "dpad": false,
      "look": false,
      "layout": "panel",
      "pointer": "move",
      "tapDuration": 80,
      "toolbar": "top-right",
      "pads": [
        {
          "side": "left",
          "mode": "wasd",
          "style": "dpad"
        }
      ],
      "actions": [
        {
          "label": "Select",
          "mouseButton": "left",
          "position": "bottom-right"
        }
      ],
      "repeatKeys": [
        "W",
        "A",
        "S",
        "D"
      ]
    }
  },
  "build": {
    "assetRoot": ".",
    "assets": []
  },
  "icon": "icon.png",
  "preview": "preview.png"
}
