{
  "version": 1,
  "name": "Audio Tone",
  "mobile": {
    "orientation": "auto",
    "fullscreen": true,
    "controls": {
      "keyboard": false,
      "mouseButtons": false,
      "quickKeys": [],
      "joystick": false,
      "pointer": "off",
      "layout": "overlay"
    },
    "theme": {
      "accent": "#72d6b0",
      "font": "sans"
    }
  },
  "build": {
    "sources": [
      "../audio_tone.c"
    ]
  }
}
