{
  "version": 1,
  "name": "FEUP Hero",
  "icon": "../../../../collections/arcade/icons/feup-hero.png",
  "mobile": {
    "orientation": "landscape",
    "fullscreen": true,
    "controls": {
      "keyboard": true,
      "mouseButtons": false,
      "quickKeys": [
        "A",
        "S",
        "D",
        "F",
        "G"
      ],
      "joystick": false,
      "layout": "panel",
      "pointer": "direct",
      "cursor": {
        "x": 400,
        "y": 500,
        "maxX": 788,
        "maxY": 585
      },
      "toolbar": "auto",
      "actions": [
        {
          "position": "top-right",
          "label": "Select",
          "key": "ENTER"
        },
        {
          "position": "top-right",
          "label": "Esc",
          "key": "ESC"
        }
      ]
    }
  },
  "build": {
    "assetRoot": "..",
    "assets": [
      "Project/beatmaps"
    ]
  },
  "description": "Hit the notes as they reach the fretboard and keep the rhythm going.",
  "preview": "../../../../collections/arcade/previews/martimcferreira-lcom-project-9a16857450a6.png"
}
