{
  "version": 1,
  "name": "Skess: Draw & Guess",
  "icon": "icon.png",
  "mobile": {
    "orientation": "landscape",
    "fullscreen": true,
    "controls": {
      "keyboard": true,
      "mouseButtons": false,
      "quickKeys": [
        "ENTER",
        "BACKSPACE",
        "ESC"
      ],
      "joystick": false,
      "pointer": "drag",
      "layout": "overlay",
      "toolbar": "top-right",
      "keyboardPosition": "bottom",
      "touch": "press"
    }
  },
  "build": {
    "assetRoot": "../..",
    "assets": []
  },
  "description": "Sketch the secret word or type your guess as another player draws.",
  "preview": "../../../../../collections/arcade/previews/scrr-az-skess-lcom-282ac263194e.png"
}
